{
  "contractVersion": "2.0",
  "state": "failed",
  "progressPercent": 0,
  "message": "Rollback command expired before its first Updater submission.",
  "errorCode": "COMMAND_EXPIRED",
  "fromVersion": null,
  "targetVersion": null,
  "versionEvidence": "unavailable",
  "observedAtUtc": "2026-09-06T03:01:00Z",
  "sequence": 0
}
